name,url,review count,rating,snippet,neighborhood,latitude,longitude,category,type
Pho Van,http://www.yelp.com/biz/pho-van-pittsburgh?utm_campaign=yelp_api&utm_medium=api_v2_business&utm_source=ERehee8c-xBF5R86JGKbYg,120,3.5,I'm quite used to Vietnamese restaurants that are both tiny and lacking in ambiance in this city and many others. That wasn't a deterrent for us and it...,Strip District,40.4519857,-79.9824067,vietnamese,food
Piccolo Forno,http://www.yelp.com/biz/piccolo-forno-pittsburgh?utm_campaign=yelp_api&utm_medium=api_v2_business&utm_source=ERehee8c-xBF5R86JGKbYg,264,4,"I feel like I wouldn't be doing anybody any favors if I didn't lead this review off with some down and dirty facts. Fact number one, our server was...",Lawrenceville,40.4670906,-79.9644394,pizza,food
Piper's Pub,http://www.yelp.com/biz/pipers-pub-pittsburgh?utm_campaign=yelp_api&utm_medium=api_v2_business&utm_source=ERehee8c-xBF5R86JGKbYg,247,4.5,"Came here at 10:45 with my husband for a late night snack and a beer. The bartender was super nice and accommodating, honored requests for extra lemon in...",South Side,40.42843246,-79.9794693,restaurants,food
Pitaland,http://www.yelp.com/biz/pitaland-pittsburgh?utm_campaign=yelp_api&utm_medium=api_v2_business&utm_source=ERehee8c-xBF5R86JGKbYg,51,4.5,"What an absolute gem to find in Brookline. Had a bit of time to grab lunch in Brookline today. This particular neighborhood is one I don't get to much, so...",Brookline,40.39487,-80.02208,cafes,food
Pittsburgh Penguins,http://www.yelp.com/biz/pittsburgh-penguins-pittsburgh?utm_campaign=yelp_api&utm_medium=api_v2_business&utm_source=ERehee8c-xBF5R86JGKbYg,22,4.5,"5 stars for a 5 star team.  Thanks you Pens for a lifetime if awesomeness.  Sure there have been some frustrating years but overall, you have recruited,...",Downtown,40.4392204,-79.9905014,arts,arts
Pittsburgh Winery,http://www.yelp.com/biz/pittsburgh-winery-pittsburgh?utm_campaign=yelp_api&utm_medium=api_v2_business&utm_source=ERehee8c-xBF5R86JGKbYg,41,4.5,"Fabulous entrance, like entering the gates of an Italian villa'. Homey entrance hugged by carafes made into retail displays. 

Winery has two floors....",Strip District,40.457335,-79.975468,arts,arts
Pizza Italia,http://www.yelp.com/biz/pizza-italia-pittsburgh?utm_campaign=yelp_api&utm_medium=api_v2_business&utm_source=ERehee8c-xBF5R86JGKbYg,25,4,This is the best pizza in Pittsburgh. They use only the freshest ingredients and are reasonably priced. I love the combination of freshly grated cheeses and...,Bloomfield,40.462719,-79.9514999,pizza,food
Pizza Perfectta,http://www.yelp.com/biz/pizza-perfectta-pittsburgh-3?utm_campaign=yelp_api&utm_medium=api_v2_business&utm_source=ERehee8c-xBF5R86JGKbYg,61,4,"It's not a complete weekend for me without a stop at Pizza Perfectta. Pittsburgh pizza shops can be hit or miss, but these folks get it right. 

The pizza...",Shadyside,40.4572601,-79.9253998,pizza,food
Pizza Taglio,http://www.yelp.com/biz/pizza-taglio-pittsburgh-2?utm_campaign=yelp_api&utm_medium=api_v2_business&utm_source=ERehee8c-xBF5R86JGKbYg,53,4,"Pizza Taglio, I love ya. I might have to say that this is the best gourmet pizza in the 'Burgh. I went here for dinner with 3 friends and we ordered 3...",East Liberty,40.46025194,-79.92502749,pizza,food
Point State Park,http://www.yelp.com/biz/point-state-park-pittsburgh?utm_campaign=yelp_api&utm_medium=api_v2_business&utm_source=ERehee8c-xBF5R86JGKbYg,48,4.5,"[Vacationer from St. Pete, Fl reporting...]

QUINTESSENTIAL 'I'M IN PITTSBURGH' PHOTO SPOT
Click! Selfie. Oops I didn't capture the fountain, buildings,...",Downtown,40.4417992,-80.0071335,active,active
Prantl's Bakery,http://www.yelp.com/biz/prantls-bakery-pittsburgh?utm_campaign=yelp_api&utm_medium=api_v2_business&utm_source=ERehee8c-xBF5R86JGKbYg,128,4,It is a wait because they are a popular bakery. I went in hoping they would have a cake for my mom and dads anniversary. And was very happy that they could...,Shadyside,40.45166779,-79.93291473,bakeries,food
Prestogeorge Fine Foods,http://www.yelp.com/biz/prestogeorge-coffee-and-tea-pittsburgh-2?utm_campaign=yelp_api&utm_medium=api_v2_business&utm_source=ERehee8c-xBF5R86JGKbYg,49,4.5,What a cute little place. Stopped in for a cup of (much needed) coffee and I was not disappointed!! Their selection of flavored lattes is unique and...,Strip District,40.450211,-79.98572,cafes,food
Prince of India,http://www.yelp.com/biz/prince-of-india-pittsburgh?utm_campaign=yelp_api&utm_medium=api_v2_business&utm_source=ERehee8c-xBF5R86JGKbYg,55,3,I really don't get all the hate that this places gets.  What brought us in was the offer they had on Group on.  Anyway I am a bit picky about India food...,Oakland,40.4416275,-79.95859528,indpak,food
Proper Brick Oven & Tap Room,http://www.yelp.com/biz/proper-brick-oven-and-tap-room-pittsburgh?utm_campaign=yelp_api&utm_medium=api_v2_business&utm_source=ERehee8c-xBF5R86JGKbYg,266,4,"I'm in love with this place! The food, atmosphere and service are always on point. 

The candy bacon is absolutely amazing and a must to start with and any...",Downtown,40.4435995,-80.0003448,pizza,food
Pusadee's Garden,http://www.yelp.com/biz/pusadees-garden-pittsburgh?utm_campaign=yelp_api&utm_medium=api_v2_business&utm_source=ERehee8c-xBF5R86JGKbYg,186,4,"Pusadee's is probably the best Thai restaurant in the city and IMO, I would rank it next to Nicki's  thai kitchen in downtown. We decided to go there on a...",Lawrenceville,40.48270035,-79.95195007,thai,food
Randyland,http://www.yelp.com/biz/randyland-pittsburgh?utm_campaign=yelp_api&utm_medium=api_v2_business&utm_source=ERehee8c-xBF5R86JGKbYg,19,5,"Unique!
Just For Fun!
Whimsical!
Amazing!
Hang out!
Enjoy!",North Side,40.4580766,-80.0098045,shopping,shopping
Red Orchid,http://www.yelp.com/biz/red-orchid-pittsburgh?utm_campaign=yelp_api&utm_medium=api_v2_business&utm_source=ERehee8c-xBF5R86JGKbYg,74,4,"Love this place! Friendly staff, great food and no wimpy heat index. I've tried a few different things on their menu and all have been fantastic!",,40.54310608,-80.02893829,thai,food
Red Tea House,http://www.yelp.com/biz/red-tea-house-pittsburgh?utm_campaign=yelp_api&utm_medium=api_v2_business&utm_source=ERehee8c-xBF5R86JGKbYg,26,4,"I've been wanting to try this place, nestled in the Virginia Manor shopping center...but I'm also really lazy on Sunday nights. The convenience of ordering...",,40.392513,-80.065826,sushi,food
Rex Theater,http://www.yelp.com/biz/rex-theater-pittsburgh-3?utm_campaign=yelp_api&utm_medium=api_v2_business&utm_source=ERehee8c-xBF5R86JGKbYg,33,4,There is no one in a 500 mile radius that works harder than Grey Area Productions. They bring you the finest of original acts that the world has to offer in...,South Side,40.4287151,-79.9825489,arts,arts
Rey Azteca,http://www.yelp.com/biz/rey-azteca-pittsburgh-2?utm_campaign=yelp_api&utm_medium=api_v2_business&utm_source=ERehee8c-xBF5R86JGKbYg,42,4.5,Best Mexican food in Pittsburgh! Service is amazing. The food is SO good! All the stars. It's lucky too!! I went on my first date with my husband there :),,40.429105,-79.810933,mexican,food
Reyna Foods,http://www.yelp.com/biz/reyna-foods-pittsburgh?utm_campaign=yelp_api&utm_medium=api_v2_business&utm_source=ERehee8c-xBF5R86JGKbYg,88,4,"This review is for the restaurant only, not the grocery store or the taco stand

If you want authentic Mexican food this is the place to get it in...",Strip District,40.45158,-79.9834824,mexican,food
Root 174,http://www.yelp.com/biz/root-174-pittsburgh?utm_campaign=yelp_api&utm_medium=api_v2_business&utm_source=ERehee8c-xBF5R86JGKbYg,123,4,"One of the best meals I've had in a long time. We started off with the coffee confit wings and mussels, both delicious. The wings were crispy and well...",,40.43253,-79.8935599,newamerican,food
Row House Cinema,http://www.yelp.com/biz/row-house-cinema-pittsburgh?utm_campaign=yelp_api&utm_medium=api_v2_business&utm_source=ERehee8c-xBF5R86JGKbYg,31,4.5,"As Mary Poppins would say, Row House Cinema is,""Practically perfect in every way.""

If you are looking for the best date night of your life, then I have you...",Lawrenceville,40.470043,-79.961151,arts,arts
Roxanne's Dried Flowers,http://www.yelp.com/biz/roxannes-dried-flowers-pittsburgh?utm_campaign=yelp_api&utm_medium=api_v2_business&utm_source=ERehee8c-xBF5R86JGKbYg,15,4,"love perusing this local shop.
the strip district is a unique area of restaurants, produce vendors, and markets. 
when you walk in to roxanne's you're not...",Strip District,40.45214844,-79.98290253,shopping,shopping
S.W. Randall Toyes & Giftes,http://www.yelp.com/biz/s-w-randall-toyes-and-giftes-pittsburgh?utm_campaign=yelp_api&utm_medium=api_v2_business&utm_source=ERehee8c-xBF5R86JGKbYg,14,4.5,"Seriously, this place is awesome. Needed a toy for my son, while I'm at a conference, and thought I'd slip in for a few minutes and get the job done. Yeah,...",Downtown,40.44228584,-79.99708302,shopping,shopping
S&D Polish Deli,http://www.yelp.com/biz/s-and-d-polish-deli-pittsburgh?utm_campaign=yelp_api&utm_medium=api_v2_business&utm_source=ERehee8c-xBF5R86JGKbYg,107,4.5,"If you're craving a filling, hearty Polish meal like your babcia used to make, you need to get yourself down to the Strip District and give S&D Polish Deli...",Strip District,40.4523578,-79.9820206,ethnicmarkets,food
Salim's Middle Eastern Food Store,http://www.yelp.com/biz/salims-middle-eastern-food-store-pittsburgh?utm_campaign=yelp_api&utm_medium=api_v2_business&utm_source=ERehee8c-xBF5R86JGKbYg,37,4.5,"So glad we were able to discover this little shop, which surprisingly doubles as a small sit-down restaurant. When you walk in you will first see the...",Bloomfield,40.45269415,-79.94949929,ethnicmarkets,food
Sam's Sun Sandwich,http://www.yelp.com/biz/sams-sun-sandwich-pittsburgh?utm_campaign=yelp_api&utm_medium=api_v2_business&utm_source=ERehee8c-xBF5R86JGKbYg,20,5,"Went to Sam's after reading some of the reviews and living relatively close by. Ordered a chicken gyro, spinach pie and grape leaves. Was not...",Carrick,40.384926,-79.978539,sandwiches,food
Sapporo Japanese Steakhouse,http://www.yelp.com/biz/sapporo-japanese-steakhouse-pittsburgh?utm_campaign=yelp_api&utm_medium=api_v2_business&utm_source=ERehee8c-xBF5R86JGKbYg,8,4.5,"My boyfriend and I are practically Hibachi connoisseurs so when we visited Pittsburgh for the weekend the first thing we Yelp searched was.. you guessed it,...",,40.4400036,-80.0909106,japanese,food
Sarafino's Pasta and Pizza,http://www.yelp.com/biz/sarafinos-pasta-and-pizza-pittsburgh-2?utm_campaign=yelp_api&utm_medium=api_v2_business&utm_source=ERehee8c-xBF5R86JGKbYg,45,4,Beans and greens are some of the best in the city.  I always get the Rita's and request gnocchi instead of the ziti and I always add meatballs - my favorite...,,40.43564335,-80.06555982,italian,food
Sawasdee Thai Kitchen,http://www.yelp.com/biz/sawasdee-thai-kitchen-pittsburgh?utm_campaign=yelp_api&utm_medium=api_v2_business&utm_source=ERehee8c-xBF5R86JGKbYg,30,4.5,"The best food around, clean delicious friendly there is nothing around like this place. I love it 
Thank you 
Minka",,40.35179012,-80.04967645,thai,food
Say Cheese Pizza Co,http://www.yelp.com/biz/say-cheese-pizza-co-pittsburgh-2?utm_campaign=yelp_api&utm_medium=api_v2_business&utm_source=ERehee8c-xBF5R86JGKbYg,17,4,Ordered from Say Cheese for the first time this past weekend. We got two salads (the Mandarin and the Steak) and some cheese sticks. The cheese sticks...,Oakland,40.43664551,-79.95384979,pizza,food
Schenley Park,http://www.yelp.com/biz/schenley-park-pittsburgh-2?utm_campaign=yelp_api&utm_medium=api_v2_business&utm_source=ERehee8c-xBF5R86JGKbYg,9,5,"Funny Things Happened at Schenley Park Sportsplex

                                                   By Ed Skirtich

     Hilarious events happened among...",Squirrel Hill,40.4342918,-79.932869,active,active
Schenley Park Visitors Center,http://www.yelp.com/biz/schenley-park-visitors-center-pittsburgh?utm_campaign=yelp_api&utm_medium=api_v2_business&utm_source=ERehee8c-xBF5R86JGKbYg,11,5,On our way to see the plants and butterflies at the Phipps Arboretum we came upon an interesting bridge in a park. Cool Europeanish love locks in Pitt...,Oakland,40.43754064,-79.94888306,active,active
Schorr Bakery,http://www.yelp.com/biz/schorr-bakery-pittsburgh-2?utm_campaign=yelp_api&utm_medium=api_v2_business&utm_source=ERehee8c-xBF5R86JGKbYg,9,5,"If I have absolutely one weakness when I go to a bakery, it's donuts. I'll order all kinds but find myself typically just having a raised glazed.

I'm sad...",West View,40.51950797,-80.03246203,bakeries,food
Senator John Heinz History Center,http://www.yelp.com/biz/senator-john-heinz-history-center-pittsburgh?utm_campaign=yelp_api&utm_medium=api_v2_business&utm_source=ERehee8c-xBF5R86JGKbYg,70,4.5,"I came here with my family the day after Christmas. We all loved it!

I will start off by saying I am NOT a history buff at all. Quite the opposite. I am...",Strip District,40.446255,-79.992683,arts,arts
Senti,http://www.yelp.com/biz/senti-pittsburgh?utm_campaign=yelp_api&utm_medium=api_v2_business&utm_source=ERehee8c-xBF5R86JGKbYg,34,3.5,"Although I bookmarked Senti MONTHS ago, I didn't have the opportunity to dine there until recently. Reservations were made for 4 people at 7:15 on a recent...",Lawrenceville,40.46421688,-79.96638473,italian,food
Sesame Garden,http://www.yelp.com/biz/sesame-garden-pittsburgh-2?utm_campaign=yelp_api&utm_medium=api_v2_business&utm_source=ERehee8c-xBF5R86JGKbYg,23,4.5,"After moving from Honolulu 15 years ago to Pittsburgh, I have gotten used to very sub-par ""Chinese"" food and how much people love General Tso's Chicken....",Mt. Washington,40.43052065,-80.00752361,chinese,food
Shale's Cafe,http://www.yelp.com/biz/shales-cafe-pittsburgh?utm_campaign=yelp_api&utm_medium=api_v2_business&utm_source=ERehee8c-xBF5R86JGKbYg,7,4.5,"Quite possibly the best bar in Pittsburgh.  Lindsay is awesome, pitchers of beer are cold and cheap and the atmosphere is fantastic.  We visited post hockey...",The Hill District,40.438529,-79.988548,nightlife,nightlife
Siam Thai Restaurant,http://www.yelp.com/biz/siam-thai-restaurant-pittsburgh?utm_campaign=yelp_api&utm_medium=api_v2_business&utm_source=ERehee8c-xBF5R86JGKbYg,15,3.5,"Today I wanted something different for lunch, so I ordered take out from Siam. I ate lunch in a couple times but many years ago and always had good service...",Downtown,40.4371292,-80.0005157,thai,food
Sichuan Gourmet,http://www.yelp.com/biz/sichuan-gourmet-pittsburgh?utm_campaign=yelp_api&utm_medium=api_v2_business&utm_source=ERehee8c-xBF5R86JGKbYg,166,4,Pretty good authentic Chinese food! My Chinese friend actually took me here and ordered all the dishes. I knew I would be in for a treat when I saw the...,Squirrel Hill,40.43586731,-79.92314148,chinese,food
Sichuan Palace,http://www.yelp.com/biz/sichuan-palace-pittsburgh-2?utm_campaign=yelp_api&utm_medium=api_v2_business&utm_source=ERehee8c-xBF5R86JGKbYg,5,4.5,I love this chinese spot. It's one of my favs in the whole pittsburgh area. Everything I've tried here has great taste and it's not too greasy. I've tried...,,40.4645049,-79.82684432,ethnicmarkets,food
Sienna Mercato,http://www.yelp.com/biz/sienna-mercato-pittsburgh?utm_campaign=yelp_api&utm_medium=api_v2_business&utm_source=ERehee8c-xBF5R86JGKbYg,367,4,"Okay people, so by now we all get the setup, right? Three floors, three different concepts (meatball (Emporio), pizza (Mezzo), and rooftop bar (Il Tetto))....",Downtown,40.4439496,-79.9964366,italian,food
Sienna On The Square,http://www.yelp.com/biz/sienna-on-the-square-pittsburgh?utm_campaign=yelp_api&utm_medium=api_v2_business&utm_source=ERehee8c-xBF5R86JGKbYg,136,4,While I was visiting the annual holiday market I decided to try this place out for lunch. I was seated immediately. The area where I was seated was a bit...,Downtown,40.44116619,-80.0022912,italian,food
Silk Road,http://www.yelp.com/biz/silk-road-pittsburgh?utm_campaign=yelp_api&utm_medium=api_v2_business&utm_source=ERehee8c-xBF5R86JGKbYg,72,4,This is hands down the best Chinese restaurant in the Burgh. It's tucked in to a small shopping plaza called Caste Village. It's decorated beautifully. It's...,,40.357799,-80.001092,japanese,food
Silver Palace Chinese Restaurant,http://www.yelp.com/biz/silver-palace-chinese-restaurant-pittsburgh?utm_campaign=yelp_api&utm_medium=api_v2_business&utm_source=ERehee8c-xBF5R86JGKbYg,12,4,"One of my favorite restaurants in Pittsburgh. 

I frequently have Silver Palace deliver food to me and I have dined in before. 

I love the food (especially...",Overbrook,40.3773994,-80.0037537,chinese,food
Simpatico Espresso,http://www.yelp.com/biz/simpatico-espresso-pittsburgh?utm_campaign=yelp_api&utm_medium=api_v2_business&utm_source=ERehee8c-xBF5R86JGKbYg,50,5,Do not give up if your confused on the location! It's a small cart but it is beyond worth it! I literally had the best iced coffee I have ever had and I'm a...,Downtown,40.44137378,-79.996646,coffee,food
Sky Vue Restaurant,http://www.yelp.com/biz/sky-vue-restaurant-west-mifflin-2?utm_campaign=yelp_api&utm_medium=api_v2_business&utm_source=ERehee8c-xBF5R86JGKbYg,1,1,Might be some of the worst service I have ever experienced. The wait staff and the owners were both rude and inappropriate. Never again.,,40.350464,-79.923111,french,food
SLICE on Broadway,http://www.yelp.com/biz/slice-on-broadway-pittsburgh?utm_campaign=yelp_api&utm_medium=api_v2_business&utm_source=ERehee8c-xBF5R86JGKbYg,61,4,Visited Pittsburgh on Sunday to shop at Ikea.  Asked Google what the best pizza in the 'burgh was and the Slice was listed among many others.  I crave New...,Beechview,40.40414,-80.030556,pizza,food
Smallman Galley,http://www.yelp.com/biz/smallman-galley-pittsburgh-2?utm_campaign=yelp_api&utm_medium=api_v2_business&utm_source=ERehee8c-xBF5R86JGKbYg,27,4.5,To say I'm THRILLED about this places existence is an understatement. To see four different chefs testing out their planned business right in front of you...,Strip District,40.4521777,-79.9837408,restaurants,food
Smiling Banana Leaf,http://www.yelp.com/biz/smiling-banana-leaf-pittsburgh?utm_campaign=yelp_api&utm_medium=api_v2_business&utm_source=ERehee8c-xBF5R86JGKbYg,312,4,"My family and I came here and had a wonderful time. The food was delicious and the restaurant staff was so kind. 

My wife had the red curry, I had the pad...",Highland Park,40.47586,-79.91946,thai,food
Soba,http://www.yelp.com/biz/soba-pittsburgh?utm_campaign=yelp_api&utm_medium=api_v2_business&utm_source=ERehee8c-xBF5R86JGKbYg,212,4,This is a copy of my review for the event that this fine establishment hosted. I was not aware that the review would not show up on their restaurant page. I...,Shadyside,40.45713043,-79.92961121,japanese,food
Sound Cat Records,http://www.yelp.com/biz/sound-cat-records-pittsburgh?utm_campaign=yelp_api&utm_medium=api_v2_business&utm_source=ERehee8c-xBF5R86JGKbYg,16,5,It's been a while since I've been here (maybe back when it was called Paul's) but I remember this place standing out as far as record shops go. It was super...,Bloomfield,40.4625092,-79.9511337,shopping,shopping
Spak Brothers Pizza and More,http://www.yelp.com/biz/spak-brothers-pizza-and-more-pittsburgh?utm_campaign=yelp_api&utm_medium=api_v2_business&utm_source=ERehee8c-xBF5R86JGKbYg,156,4,"As far as neighborhood pizza joints go, this one kills. Best in town. I grew up with Philly pizza, so, I am picky. There's lots of just bad pizza in Pgh,...",Garfield,40.46508,-79.94253,pizza,food
Spoon,http://www.yelp.com/biz/spoon-pittsburgh?utm_campaign=yelp_api&utm_medium=api_v2_business&utm_source=ERehee8c-xBF5R86JGKbYg,216,4,"This I can tell you:  If you give Spoon three stars or fewer, you're lousy in the sack.

Here, every dish beams with a sweet, vulnerable, generous...",Shadyside,40.46004398,-79.92521998,newamerican,food
Sree's Foods,http://www.yelp.com/biz/srees-foods-pittsburgh-2?utm_campaign=yelp_api&utm_medium=api_v2_business&utm_source=ERehee8c-xBF5R86JGKbYg,48,3.5,The best place ! You can't get a great lunch like this for the price in the city. I've never been disappointed in the 7 plus years that I've been eating...,Downtown,40.4430313,-79.9968719,indpak,food
Sree's Indian Truck,http://www.yelp.com/biz/srees-indian-truck-pittsburgh?utm_campaign=yelp_api&utm_medium=api_v2_business&utm_source=ERehee8c-xBF5R86JGKbYg,4,4,"This is actually an outpost of Sree's restaurant in Squirrel Hill.
Despite the somewhat low-rent appearance of the trailer, the food is actually really...",Squirrel Hill,40.44170511,-79.94161963,indpak,food
Staghorn Home & Garden Cafe,http://www.yelp.com/biz/staghorn-home-and-garden-cafe-pittsburgh?utm_campaign=yelp_api&utm_medium=api_v2_business&utm_source=ERehee8c-xBF5R86JGKbYg,15,4.5,"I love this place. I only wish it was a little closer to the Swissvale neighborhood. I stopped here one day for a coffee, Zeke's coffee, when I was out on...",Greenfield,40.4258308,-79.9418564,coffee,food
Stagioni,http://www.yelp.com/biz/stagioni-pittsburgh?utm_campaign=yelp_api&utm_medium=api_v2_business&utm_source=ERehee8c-xBF5R86JGKbYg,65,4,"Stagioni has managed to stay under the radar and I don't know how that is possible. Their food, atmosphere and service are all top-notch. My husband and I...",South Side,40.42832,-79.97593,italian,food
Station,http://www.yelp.com/biz/station-pittsburgh?utm_campaign=yelp_api&utm_medium=api_v2_business&utm_source=ERehee8c-xBF5R86JGKbYg,83,4,"After hearing people rave about the food here, hubby and I decided to check this place out for our new New Years Eve tradition of getting a burger.

We...",Bloomfield,40.46115112,-79.94852448,newamerican,food
Stone Neapolitan Pizzeria,http://www.yelp.com/biz/stone-neapolitan-pizzeria-pittsburgh?utm_campaign=yelp_api&utm_medium=api_v2_business&utm_source=ERehee8c-xBF5R86JGKbYg,111,4,Stone is one of my favorite pizza places. I've never understood why Stone hasn't gotten much recognition or attention as far as pizza joints go.  In my...,Downtown,40.440551,-80.0061829,pizza,food
Stout Training Pittsburgh / Team Renzo Gracie,http://www.yelp.com/biz/stout-training-pittsburgh-team-renzo-gracie-pittsburgh-2?utm_campaign=yelp_api&utm_medium=api_v2_business&utm_source=ERehee8c-xBF5R86JGKbYg,15,5,"Warren, Andy, Mike, and Cody are some of the most caring coaches I have met in Martial Arts. To them, the key to having a successful business is being a...",Strip District,40.44851467,-79.99111176,active,active
Sukhothai,http://www.yelp.com/biz/sukhothai-pittsburgh-2?utm_campaign=yelp_api&utm_medium=api_v2_business&utm_source=ERehee8c-xBF5R86JGKbYg,1,3,my girlfriend and I are on a thai restaurant tour of pittsburgh. this place was average for thai in pittsburgh. but the service was attentive and the place...,Oakland,40.436539,-79.954727,ethnicmarkets,food
Sukhothai Bistro,http://www.yelp.com/biz/sukhothai-bistro-pittsburgh-2?utm_campaign=yelp_api&utm_medium=api_v2_business&utm_source=ERehee8c-xBF5R86JGKbYg,63,4,"Sukhothai is one of many Thai restaurants in Squirrel Hill. It's consistently a good option as a student because they offer delivery. 

The food is good,...",Squirrel Hill,40.4381714,-79.9223785,thai,food
Sumi's Cakery,http://www.yelp.com/biz/sumis-cakery-pittsburgh?utm_campaign=yelp_api&utm_medium=api_v2_business&utm_source=ERehee8c-xBF5R86JGKbYg,40,4.5,"I love this bakery. I've only tried their buns (which are great), but I finally got to try their bingsoo today! Got the green tea one and it was amazing....",Squirrel Hill,40.4331,-79.92289,bakeries,food
Sunseri Jimmy & Nino,http://www.yelp.com/biz/sunseri-jimmy-and-nino-pittsburgh?utm_campaign=yelp_api&utm_medium=api_v2_business&utm_source=ERehee8c-xBF5R86JGKbYg,23,4,"This place is the deli you have always dreamed about.  The sights, the smells, the tastes...  Delicious!  The fresh bread is amazing, the stuffed pizzelle's...",Strip District,40.4509583,-79.9846191,italian,food
Sunseri Pizza,http://www.yelp.com/biz/sunseri-pizza-pittsburgh?utm_campaign=yelp_api&utm_medium=api_v2_business&utm_source=ERehee8c-xBF5R86JGKbYg,9,5,"Pittsburgh is where I have to travel to if I have a craving for a pizza with good sauce, cheese and delicious toppings. The meat to sauce to crust ratio was...",,40.39377,-79.97324,pizza,food
Sushi & Rolls,http://www.yelp.com/biz/sushi-and-rolls-pittsburgh?utm_campaign=yelp_api&utm_medium=api_v2_business&utm_source=ERehee8c-xBF5R86JGKbYg,18,4.5,Wonderful place for a donburi fix! I am so happy to have found this place. I grew up on Asian food and miss it so much since moving to Pittsburgh. I have...,Downtown,40.4381218,-79.9988098,sushi,food
Sushi Fuku,http://www.yelp.com/biz/sushi-fuku-pittsburgh?utm_campaign=yelp_api&utm_medium=api_v2_business&utm_source=ERehee8c-xBF5R86JGKbYg,98,4,"This place is truly a hidden gem. I've never been to a place like this!

So it's basically Japanese chipotle. I'm not a big sushi eater, so this place is...",Oakland,40.441662,-79.957359,sushi,food
Sushi Tomo,http://www.yelp.com/biz/sushi-tomo-pittsburgh?utm_campaign=yelp_api&utm_medium=api_v2_business&utm_source=ERehee8c-xBF5R86JGKbYg,63,4,Great Japanese food. Great sushi. This is as good as it gets on McKnight Road. I highly recommend Sushi Tomo.,,40.52578,-80.00512,sushi,food
Taj Mahal,http://www.yelp.com/biz/taj-mahal-pittsburgh?utm_campaign=yelp_api&utm_medium=api_v2_business&utm_source=ERehee8c-xBF5R86JGKbYg,168,4,Awesome lunch buffet place with lots of options. There was plenty of vegetarian and some vegan dishes as well as the usual meat dishes like chicken marsala...,,40.54744339,-80.01860809,indpak,food
